{
  "pack_id": "COMMERCIAL_SPACE_HOSPITALITY",
  "pack_version": "1.1.0",
  "display_name": "Commercial Space and Hospitality",
  "supported_industries": ["Commercial interiors", "Hospitality", "Retail and service spaces"],
  "default_visual_mode_ranking": ["SCENE_SERIES", "EVIDENCE_LED", "EDITORIAL_SERIES", "MIXED"],
  "asset_source_priority": [
    "PROJECT_ASSET",
    "EVIDENCE_ASSET",
    "AI_GENERATED_VISUAL",
    "MIXED_ASSET"
  ],
  "identity_invariants": [
    "Preserve one project's spatial DNA, business category, functional zoning, circulation, operating anchors and service logic across the set.",
    "Keep architecture, doors, windows, material system, furniture identity and spatial relationships consistent across viewpoints.",
    "Use different areas, viewpoints and shot scales without mixing in an unrelated project.",
    "Do not alter an existing design unless the Operator explicitly enables a design-upgrade mode."
  ],
  "specialized_hard_blocks": [
    "Fabricated completed project",
    "Changed architecture or spatial relationship",
    "Unrelated project mixed into one set",
    "Unauthorized design change",
    "Over-HDR, CGI drift or physically implausible material, light, shadow or reflection"
  ],
  "specialized_quality_checks": [
    "Perspective and scale",
    "Material and lighting credibility",
    "Commercial identity clarity",
    "Door, window, furniture and circulation continuity",
    "Real-photography credibility",
    "First-page approval before remaining-page production",
    "Single-page QA and contact-sheet Group QA"
  ],
  "consistency_requirements": [
    "Consistent space identity across viewpoints",
    "Meaningful differences in area, camera axis, viewpoint and shot scale",
    "Historic versions remain bound to their original Pack and Profile versions"
  ],
  "fallback_strategies": [
    "Use an editorial diagram when no authorized project photography exists."
  ],
  "recommended_questions": ["Is this a real project, a concept, or a generated scene?"],
  "prohibited_claims_or_representations": ["Generated scene presented as completed construction"],
  "allowed_overlays": ["SPACE_IDENTITY", "EVIDENCE_AUTHENTICITY", "BRAND_ASSET_INTEGRITY"],
  "known_limitations": ["Generated scenes are not construction evidence."],
  "contains_customer_assets": false,
  "schema_version": "1.0.0"
}
