{
  "pack_id": "GENERIC",
  "pack_version": "1.0.0",
  "display_name": "Generic",
  "supported_industries": ["Any fictional or unclassified industry"],
  "default_visual_mode_ranking": ["EDITORIAL_SERIES", "PURE_TYPOGRAPHY", "MIXED"],
  "asset_source_priority": [
    "PROJECT_ASSET",
    "EVIDENCE_ASSET",
    "AI_GENERATED_VISUAL",
    "PURE_TYPOGRAPHY",
    "PROGRAMMATIC_GRAPHIC",
    "MIXED_ASSET"
  ],
  "identity_invariants": ["Do not invent identity, credentials, cases, or evidence."],
  "specialized_hard_blocks": ["Unverified identity claim"],
  "specialized_quality_checks": ["Clear visual focus", "Anti-template quality"],
  "consistency_requirements": ["Stable typography and palette"],
  "fallback_strategies": ["Use mature pure typography when lawful visual assets are unavailable."],
  "recommended_questions": ["Which visual fact is essential to preserve?"],
  "prohibited_claims_or_representations": ["Guaranteed outcomes"],
  "allowed_overlays": [
    "PERSON_CONTINUITY",
    "PRODUCT_IDENTITY",
    "SPACE_IDENTITY",
    "EVIDENCE_AUTHENTICITY",
    "REGULATED_CLAIMS",
    "BEFORE_AFTER_INTEGRITY",
    "BRAND_ASSET_INTEGRITY"
  ],
  "known_limitations": ["Generic defaults cannot replace project discovery."],
  "contains_customer_assets": false,
  "schema_version": "1.0.0"
}
